{
  "$schema": "https://json-schema.org/draft/2020-12/schema",
  "$id": "https://westkitty.github.io/Starsilk_Character_Dossier/machine/schema/v1/tour-index.schema.json",
  "title": "Starsilk curated tour index v1",
  "type": "object",
  "additionalProperties": false,
  "required": ["schema", "schema_url", "project_id", "canonical_url", "human_url", "source_ref", "tour_count", "tours", "local_state_policy", "interpretation_rules"],
  "properties": {
    "schema": {"const": "starsilk-tour-index/1"},
    "schema_url": {"type": "string", "format": "uri"},
    "project_id": {"const": "starsilk-character-dossier"},
    "canonical_url": {"type": "string", "format": "uri"},
    "human_url": {"type": "string", "format": "uri"},
    "source_ref": {"const": "src/tours/tours.json"},
    "tour_count": {"type": "integer", "minimum": 0},
    "tours": {
      "type": "array",
      "items": {
        "type": "object",
        "additionalProperties": false,
        "required": ["tour_id", "label", "canonical_url", "navigation_group", "source_refs", "stop_count", "stops"],
        "properties": {
          "tour_id": {"type": "string", "pattern": "^[a-z0-9][a-z0-9-]*$"},
          "label": {"type": "string", "minLength": 1},
          "canonical_url": {"type": "string", "format": "uri"},
          "navigation_group": {"type": "string", "minLength": 1},
          "source_refs": {
            "type": "array",
            "minItems": 2,
            "items": {
              "type": "object",
              "additionalProperties": false,
              "required": ["path", "kind"],
              "properties": {
                "path": {"type": "string", "minLength": 1},
                "anchor": {"type": "string", "minLength": 1},
                "kind": {"enum": ["editorial-navigation", "authoritative-navigation"]}
              }
            }
          },
          "stop_count": {"type": "integer", "minimum": 1},
          "stops": {
            "type": "array",
            "minItems": 1,
            "items": {
              "type": "object",
              "additionalProperties": false,
              "required": ["position", "stable_id", "display_label", "canonical_url", "legacy_url", "source_ref"],
              "properties": {
                "position": {"type": "integer", "minimum": 1},
                "stable_id": {"type": "string", "minLength": 1},
                "display_label": {"type": "string", "minLength": 1},
                "canonical_url": {"type": "string", "format": "uri"},
                "legacy_url": {"type": "string", "format": "uri"},
                "source_ref": {"const": "src/content/nav.json"}
              }
            }
          }
        }
      }
    },
    "local_state_policy": {
      "type": "object",
      "additionalProperties": false,
      "required": ["scope", "account_required", "analytics_or_telemetry", "published", "private_text_in_urls"],
      "properties": {
        "scope": {"const": "browser-local"},
        "account_required": {"const": false},
        "analytics_or_telemetry": {"const": false},
        "published": {"const": false},
        "private_text_in_urls": {"const": false}
      }
    },
    "interpretation_rules": {
      "type": "array",
      "minItems": 1,
      "items": {"type": "string", "minLength": 1}
    }
  }
}
