{
  "canonical_url": "https://westkitty.github.io/Starsilk_Character_Dossier/tours/tours.json",
  "human_url": "https://westkitty.github.io/Starsilk_Character_Dossier/tours/",
  "interpretation_rules": [
    "Tour order is editorial navigation only and does not assert chronology, causality, importance, or semantic relationships.",
    "Tour stops reference existing stable records and do not duplicate or replace canon prose.",
    "Bookmarks, recent openings, history, progress, and named collections are browser-local user state and never canon evidence.",
    "User-authored local collection names are not serialized into public URLs or generated publication."
  ],
  "local_state_policy": {
    "account_required": false,
    "analytics_or_telemetry": false,
    "private_text_in_urls": false,
    "published": false,
    "scope": "browser-local"
  },
  "project_id": "starsilk-character-dossier",
  "schema": "starsilk-tour-index/1",
  "schema_url": "https://westkitty.github.io/Starsilk_Character_Dossier/machine/schema/v1/tour-index.schema.json",
  "source_ref": "src/tours/tours.json",
  "tour_count": 6,
  "tours": [
    {
      "canonical_url": "https://westkitty.github.io/Starsilk_Character_Dossier/tours/#tour-overview",
      "label": "Overview",
      "navigation_group": "Overview",
      "source_refs": [
        {
          "anchor": "overview",
          "kind": "editorial-navigation",
          "path": "src/tours/tours.json"
        },
        {
          "anchor": "Overview",
          "kind": "authoritative-navigation",
          "path": "src/content/nav.json"
        }
      ],
      "stop_count": 3,
      "stops": [
        {
          "canonical_url": "https://westkitty.github.io/Starsilk_Character_Dossier/entities/cover/",
          "display_label": "Starsilk Compendium",
          "legacy_url": "https://westkitty.github.io/Starsilk_Character_Dossier/#cover",
          "position": 1,
          "source_ref": "src/content/nav.json",
          "stable_id": "cover"
        },
        {
          "canonical_url": "https://westkitty.github.io/Starsilk_Character_Dossier/entities/world/",
          "display_label": "The All is programmable. Meaning is not optional.",
          "legacy_url": "https://westkitty.github.io/Starsilk_Character_Dossier/#world",
          "position": 2,
          "source_ref": "src/content/nav.json",
          "stable_id": "world"
        },
        {
          "canonical_url": "https://westkitty.github.io/Starsilk_Character_Dossier/entities/chronology/",
          "display_label": "Reality begins as betrayal. The future is built by exclusion.",
          "legacy_url": "https://westkitty.github.io/Starsilk_Character_Dossier/#chronology",
          "position": 3,
          "source_ref": "src/content/nav.json",
          "stable_id": "chronology"
        }
      ],
      "tour_id": "overview"
    },
    {
      "canonical_url": "https://westkitty.github.io/Starsilk_Character_Dossier/tours/#tour-principal-characters",
      "label": "Principal characters",
      "navigation_group": "Principal characters",
      "source_refs": [
        {
          "anchor": "principal-characters",
          "kind": "editorial-navigation",
          "path": "src/tours/tours.json"
        },
        {
          "anchor": "Principal characters",
          "kind": "authoritative-navigation",
          "path": "src/content/nav.json"
        }
      ],
      "stop_count": 6,
      "stops": [
        {
          "canonical_url": "https://westkitty.github.io/Starsilk_Character_Dossier/entities/shard-god/",
          "display_label": "Shard-God Tiger",
          "legacy_url": "https://westkitty.github.io/Starsilk_Character_Dossier/#shard-god",
          "position": 1,
          "source_ref": "src/content/nav.json",
          "stable_id": "shard-god"
        },
        {
          "canonical_url": "https://westkitty.github.io/Starsilk_Character_Dossier/entities/codec/",
          "display_label": "Codec",
          "legacy_url": "https://westkitty.github.io/Starsilk_Character_Dossier/#codec",
          "position": 2,
          "source_ref": "src/content/nav.json",
          "stable_id": "codec"
        },
        {
          "canonical_url": "https://westkitty.github.io/Starsilk_Character_Dossier/entities/dao/",
          "display_label": "Dao",
          "legacy_url": "https://westkitty.github.io/Starsilk_Character_Dossier/#dao",
          "position": 3,
          "source_ref": "src/content/nav.json",
          "stable_id": "dao"
        },
        {
          "canonical_url": "https://westkitty.github.io/Starsilk_Character_Dossier/entities/kail/",
          "display_label": "Kail",
          "legacy_url": "https://westkitty.github.io/Starsilk_Character_Dossier/#kail",
          "position": 4,
          "source_ref": "src/content/nav.json",
          "stable_id": "kail"
        },
        {
          "canonical_url": "https://westkitty.github.io/Starsilk_Character_Dossier/entities/marcel/",
          "display_label": "Marcel",
          "legacy_url": "https://westkitty.github.io/Starsilk_Character_Dossier/#marcel",
          "position": 5,
          "source_ref": "src/content/nav.json",
          "stable_id": "marcel"
        },
        {
          "canonical_url": "https://westkitty.github.io/Starsilk_Character_Dossier/entities/jazen/",
          "display_label": "Jazen",
          "legacy_url": "https://westkitty.github.io/Starsilk_Character_Dossier/#jazen",
          "position": 6,
          "source_ref": "src/content/nav.json",
          "stable_id": "jazen"
        }
      ],
      "tour_id": "principal-characters"
    },
    {
      "canonical_url": "https://westkitty.github.io/Starsilk_Character_Dossier/tours/#tour-drakken-blood-systems",
      "label": "Drakken",
      "navigation_group": "Drakken",
      "source_refs": [
        {
          "anchor": "drakken-blood-systems",
          "kind": "editorial-navigation",
          "path": "src/tours/tours.json"
        },
        {
          "anchor": "Drakken",
          "kind": "authoritative-navigation",
          "path": "src/content/nav.json"
        }
      ],
      "stop_count": 61,
      "stops": [
        {
          "canonical_url": "https://westkitty.github.io/Starsilk_Character_Dossier/entities/drakken-registry/",
          "display_label": "The full field register.",
          "legacy_url": "https://westkitty.github.io/Starsilk_Character_Dossier/#drakken-registry",
          "position": 1,
          "source_ref": "src/content/nav.json",
          "stable_id": "drakken-registry"
        },
        {
          "canonical_url": "https://westkitty.github.io/Starsilk_Character_Dossier/entities/gorevault/",
          "display_label": "Gorevault",
          "legacy_url": "https://westkitty.github.io/Starsilk_Character_Dossier/#gorevault",
          "position": 2,
          "source_ref": "src/content/nav.json",
          "stable_id": "gorevault"
        },
        {
          "canonical_url": "https://westkitty.github.io/Starsilk_Character_Dossier/entities/ringthroat/",
          "display_label": "Ringthroat",
          "legacy_url": "https://westkitty.github.io/Starsilk_Character_Dossier/#ringthroat",
          "position": 3,
          "source_ref": "src/content/nav.json",
          "stable_id": "ringthroat"
        },
        {
          "canonical_url": "https://westkitty.github.io/Starsilk_Character_Dossier/entities/lyriboris/",
          "display_label": "Lyriboris",
          "legacy_url": "https://westkitty.github.io/Starsilk_Character_Dossier/#lyriboris",
          "position": 4,
          "source_ref": "src/content/nav.json",
          "stable_id": "lyriboris"
        },
        {
          "canonical_url": "https://westkitty.github.io/Starsilk_Character_Dossier/entities/mother/",
          "display_label": "Mother",
          "legacy_url": "https://westkitty.github.io/Starsilk_Character_Dossier/#mother",
          "position": 5,
          "source_ref": "src/content/nav.json",
          "stable_id": "mother"
        },
        {
          "canonical_url": "https://westkitty.github.io/Starsilk_Character_Dossier/entities/drk-the-egg/",
          "display_label": "The Egg",
          "legacy_url": "https://westkitty.github.io/Starsilk_Character_Dossier/#drk-the-egg",
          "position": 6,
          "source_ref": "src/content/nav.json",
          "stable_id": "drk-the-egg"
        },
        {
          "canonical_url": "https://westkitty.github.io/Starsilk_Character_Dossier/entities/drk-magma-pleuron/",
          "display_label": "Magma Pleuron",
          "legacy_url": "https://westkitty.github.io/Starsilk_Character_Dossier/#drk-magma-pleuron",
          "position": 7,
          "source_ref": "src/content/nav.json",
          "stable_id": "drk-magma-pleuron"
        },
        {
          "canonical_url": "https://westkitty.github.io/Starsilk_Character_Dossier/entities/drk-granithelion/",
          "display_label": "Granithelion",
          "legacy_url": "https://westkitty.github.io/Starsilk_Character_Dossier/#drk-granithelion",
          "position": 8,
          "source_ref": "src/content/nav.json",
          "stable_id": "drk-granithelion"
        },
        {
          "canonical_url": "https://westkitty.github.io/Starsilk_Character_Dossier/entities/drk-fault-tongue/",
          "display_label": "Fault-Tongue",
          "legacy_url": "https://westkitty.github.io/Starsilk_Character_Dossier/#drk-fault-tongue",
          "position": 9,
          "source_ref": "src/content/nav.json",
          "stable_id": "drk-fault-tongue"
        },
        {
          "canonical_url": "https://westkitty.github.io/Starsilk_Character_Dossier/entities/drk-obsidian-gul/",
          "display_label": "Obsidian Gul",
          "legacy_url": "https://westkitty.github.io/Starsilk_Character_Dossier/#drk-obsidian-gul",
          "position": 10,
          "source_ref": "src/content/nav.json",
          "stable_id": "drk-obsidian-gul"
        },
        {